<?xml version="1.0" encoding="UTF-8"?>
<!-- Copyright DASSAULT SYSTEMES 2013 -->
<Config name="ProductsAndParts" xmlns="DS_DELPPWConfiguration" xmlns:xsi="http://www.w3.org/2001/XMLSchema-instance" xsi:schemaLocation="DS_DELPPWConfiguration ../xsd/ColumnConfig.xsd" Title="UI Config" Description="Sample configuration file delivered by DS.">
    <Label		dataIndex="V_Name.reference"		dicoType="PLMEntity"		displayType="NonEditable"/>
    <Columns>
        <Column dataIndex="PLM_ExternalID.instance"       dicoType="PLMCoreInstance"    displayType="NonEditable"  />
        <Column	dataIndex="revision.reference"		        dicoType="BusinessType"		    displayType="NonEditable"/>
        <Column dataIndex="ProductAssignmentStatus"       displayType="BIEssentials"/>
        <Column dataIndex="V_IsManufacturable.reference"       dicoType="VPMReference"  displayType="NonEditable"/>
        <Column dataIndex="AltSubBI"                      displayType="BIEssentialsAltSub"/>
        <Column	dataIndex="V_description.reference"	      dicoType="PLMEntity"		      displayType="NonEditable" Tooltip="NameRevisionOwner.tooltip"/>
        <Column	dataIndex="owner.reference"			          dicoType="BusinessType"		    displayType="NonEditable"/>
        <Column	dataIndex="PLM_ExternalID.reference"			dicoType="PLMEntity"		      displayType="NonEditable"/>
        <Column	dataIndex="V_isLastVersion.reference"			dicoType="PLMCoreReference"		displayType="NonEditable"/>
        <Column	dataIndex="current.reference"		          dicoType="BusinessType"		    displayType="NonEditable"/>
        <Column dataIndex="EnterpriseExtension.V_PartNumber.reference"  dicoType="EnterpriseExtension"                  displayType="NonEditable"/>
        <!-- CONFIGURATION COLUMNS: start -->
        <Column dataIndex="ConfigurationContext" displayType="CFG" display="false"/><!-- Available if atleast CFG/CSV role is valid -->
        <Column dataIndex="Effectivity" displayType="CFG" display="false"/><!-- Available if atleast CFG/CSV role is valid -->
        <Column dataIndex="VariantEffectivity" displayType="CFG" display="false"/><!-- Available if atleast CFG/CSV role is valid -->
        <Column dataIndex="CurrentEvolutionEffectivity" displayType="CFG" display="false"/><!-- Available only if CHG role is valid -->
        <Column dataIndex="ProjectedEvolutionEffectivity" displayType="CFG" display="false"/><!-- Available only if CHG role is valid -->
        <Column dataIndex="EvolutionEffectivity" displayType="CFG" display="false"/><!-- Available only if CFG/CSV role is valid without CHG role -->
        <!-- CONFIGURATION COLUMNS: end -->
    </Columns>
</Config>
