<?xml version="1.0" encoding="UTF-8"?>
<!-- Copyright DASSAULT SYSTEMES 2013 -->
<Config name="Manufacturing" xmlns="DS_DELPPWConfiguration" xmlns:xsi="http://www.w3.org/2001/XMLSchema-instance" xsi:schemaLocation="DS_DELPPWConfiguration ../xsd/ColumnConfig.xsd" Title="UI Config" Description="Sample configuration file delivered by DS.">
    <Label dataIndex="V_Name.reference" dicoType="PLMEntity" displayType="NonEditable"/>
    <Columns>
        <Column dataIndex="type.reference" displayType="CustomString"/>
        <Column dataIndex="V_Outsourced.reference" displayType="NonEditable"/>
        <Column dataIndex="revision.reference" displayType='URL' dicoType="BusinessType"/>
        <Column dataIndex="owner.reference"  displayType="FullOwnerURL" dicoType="BusinessType"/>
        <Column dataIndex="organization.reference" displayType='URL' dicoType="BusinessType"/>
        <Column dataIndex="project.reference"  displayType='URL'/>
        <Column dataIndex="current.reference"  displayType='URL' dicoType="BusinessType"/>
        <Column dataIndex="V_description.reference" dicoType="PLMEntity" displayType="NonEditable"/>
    </Columns>
</Config>
